url_id,article_title,article_text
37,,"“If anything kills over 10 million people in the next few decades, it will be a highly infectious virus rather than a war. Not missiles but microbes.” Bill Gates’s remarks at a TED conference in 2014, right after the world had avoided the Ebola outbreak. When the new, unprecedented, invisible virus hit us, it met an overwhelmed and unprepared healthcare system and oblivious population. This public health emergency demonstrated our lack of scientific consideration and underlined the alarming need for robust innovations in our health and medical facilities. For the past few years, artificial intelligence has proven to be of tangible potential in the healthcare sectors, clinical practices, translational medical and biomedical research."
39,What Jobs Will Robots Take From Humans in The Future?,"AI is rapidly evolving in the employment sector, particularly in matters involving business and finance. Finance, management, economics, and accounting are now among the most popular university courses globally; particularly at the graduate level, due to their high employability. However, the evolution of machinery in industries is changing that. According to research, 230,000 jobs in these sectors may be replaced by AI agents in the next 5 years. This is due to the nature of the work, as employees are responsible for tasks such as data analysis and keeping track of numerical information; which machines excel at. Large, complicated data sets can be analyzed faster and more efficiently by AI-powered computers than by people. Algorithmic trading procedures that produce automated deals are less likely to be produced without minute errors when undertaken by humans. In such matters involving industrial work, a subsection of artificial intelligence is used; namely, machine learning."
42,Will machine replace the human in the future of work?,"Where is this disruptive technology taking us? Take it or leave it, disruptive technology always creates new jobs much more than depleted jobs. You might notice certain jobs disappearing but those jobs are the jobs that transform humans to robots, to machines, and the technology is creating machines to replace them.  Technology creates the data analysis tools to manipulate and create custom scenarios using artificial intelligence (AI), Big Data and Machine Learning (ML) algorithms to predict and drive consumer behavior. Data Analytics tools, such as Google Analytics , and others are available today for free, and, if used correctly, can help organizations save millions, maybe billions of dollars of sales and marketing."
38,What if the Creation is Taking Over the Creator?,"Human minds, a fascination in itself carrying the potential of tinkering nature with the pixie dust intelligence, creating and solving the mysteries and wonders with anything but admiration. However, no matter how captivating a human mind can be, it could sometimes be appalled. It could be the hunger or maybe the desire to want more, to go beyond and unravel the limitations, or maybe something like pure greed. Humans have never stopped and always keep evolving when it comes to intelligence and this is what makes them the supreme."
41,Will AI Replace Us or Work With Us?,“Machine intelligence is the last invention that humanity will ever need to make”
40,Will Machine Replace The Human in the Future of Work?,"“Anything that could give rise to smarter-than-human intelligence – in the form of Artificial Intelligence, brain-computer interfaces, or neuroscience-based human intelligence enhancement – wins hands down beyond contest as doing the most to change the world. Nothing else is even in the same league.” "
43,How humans and machines are evolving to work together?,In future or in upcoming years humans and machines are going to work together in every field of work. In upcoming days machines will be the need for every human being. Machines [AI technology] will do the work which humans are incapable of doing. Machines will partner and co-operate with humans.
45,How machine learning will affect your business?,"Machine learning techniques may have been used for years, but recently there has been an explosion in their applications. In fact, in a recent Q3 earnings call, Google CEO Sundar Pichai said “Machine learning is a core, transformative way by which we’re re-thinking how we’re doing everything.” And they’re far from the only business making that claim."
46,Deep learning impact on areas of e-learning?,"eLearning as technology becomes more affordable in higher education but having a big barrier in the cost of developing its resources. Deep learning using artificial intelligence continues to become more and more popular and having impacts on many areas of eLearning. It offers online learners of the future intuitive algorithms and automated delivery of eLearning content through modern LMS platforms. This paper aims to survey various applications of deep learning approaches for developing the resources of the eLearning platform, in which predictions, algorithms, and analytics come together to create more personalized future eLearning experiences. In addition, deep learning models for developing the contents of the eLearning platform, deep learning framework that enable deep learning systems into eLearning and its development, benefits & future trends of deep learning in eLearning, the relevant deep learning-based artificial intelligence tools, and a platform enabling the developer and learners to quickly reuse resources are clearly summarized. Thus, deep learning has evolved into developing ways to re-purpose existing resources that can mitigate the expense of content development of future eLearning."
49,How Robo Human will Impact the Future?,"It’s the year 2060. An automaton in a Research Laboratory says to a Scientist, “Warning! Error Occurred Reformatting Hard Disk Now!” The scientist panics. Automaton says again,” Ha! Ha! Just Kidding! “."
50,How AI will change the World?,"The way work is being done now is destined to undergo massive transformational changes which will impact humans and their ways of working dramatically. With the development of the new machine programs, A.I. is all set to take over the humans in their workplace as no other did. Now we are not only in competition with other beings but with robots too. And robots will overcome us in our fields of work."
47,How to protect future data and its privacy?,"Before the internet, information was in some ways restricted and more centralized. The only mediums of information were books, newspapers, and word of mouth, etc. But now with the advent of the internet and improvements to computer technology (Moore’s Law), information and data skyrocketed, and it has become this open-system, where information can be distributed to people without any kind of limits."
48,"How Machines, AI, Automations, and Robo-human are Effective in Finance and Banking?",We all hear day in and day out that we amidst a 
51,,"Artificial intelligence and employment are the burning issues nowadays workers need clarity on as we head into the longer term. This article focuses on the various impact of AI on our jobs and explains the benefits of AI in our workplace. That right there must have hit a nerve. However, everything is about to change because this article highlights some of the reasons we should not fear AI."
52,How machine learning used in finance and banking?,"Through AI tools like natural language processing, Alexa and google assistant has led the retail industry in its rise towards conversational commerce. As if a customer was interacting with a clerk in a retail store, conversational commerce makes it possible for users to engage with software to research, purchase, or get customer assistance with products and services across a wide range of industries. With Alexa, for example, users can ask any Alexa-enabled device to add an item to an Amazon shopping cart, set a purchasing reminder when a product is running low, or carry out a complete purchase without having to access a shopping cart. The result is a seamless conversational experience that enables consumers to carry out transactions as quickly as it takes to speak a sentence."
53,How AI will impact the future of work?,AI experts believe it’s going to be one of the main 
54,All you need to know about online marketing, 
55,Evolution of Advertising Industry,"ral different forms, and the intended message can differ from genre to genre. The target for each medium could be different. Advertised content could be in print, radio, TV, or digital formats."
56,How Data Analytics can help your business respond to the impact of COVID-19?,"Before we get into the whole discussion, let’s first discuss the basic working of data analysis."
58,Environmental impact of the COVID-19 pandemic – Lesson for the Future,"The Covid- 19 pandemics forced factories to shut down, flights getting canceled and a massive decrease in the global economy, with a significant decrease in Green House Gases (GHG) in many developed and developing countries."
59,How Data Analytics and AI are used to halt the COVID-19 Pandemic?,"Even though COVID-19 has not yet halted and we are facing the nth wave of the coronavirus outbreak across several countries, most notably the US, India, and Brazil. It is a fact that Data Analytics and AI are the big guns of our artillery in this fight against the COVID-19 pandemic. It has helped us in several stages of this outbreak, like the detection of its first outbreak, vaccine development and manufacturing contact tracing, and future hotspot detection. Some of these interesting applications are discussed in this article."
60,"What is the difference between Artificial Intelligence, Machine Learning, Statistics, and Data Mining?",“Data is the new oil” has become the most important trendline of the 21
62,How Google fit measure heart and respiratory rates using a phone camera?,It was in March that Tech giant Google came up with a ground-breaking announcement of Google Fit able to measure one’s heart and respiratory rates using their smartphones. This news spread like wildfire. Instantly became the talk of the town. This feature was said to be available to the Google Fit app exclusively to its Pixel phone users. Google also plans to expand to its other Android devices in the future.
61,How Python became the first choice for Data Science.,"Data Science is gaining popularity exponentially over the past decade, and thanks to that we are now enjoying better products, recommendations, and smoother life. Data science is an interdisciplinary subject that includes statistics, math, IT, etc."
63,What is the future of mobile apps?,"From what I have learned on the mobile apps development market recently, it is becoming harder for an Android or iOS developer to find a suitable and well-paying job in the market."
64,Impact of AI in health and medicine,"AI allows those in training to go through naturalistic simulations in a way that simple computer-driven algorithms cannot. The advent of natural speech and the ability of an AI  computer to draw instantly on a large database of scenarios means the response to questions, decisions, or advice from a trainee can challenge in a way that humans cannot in health and medicine"
65,What patients like and dislike about telemedicine?,"In today’s world, telemedicine technology is one of those technologies which has brought about a change. Compared to the early days there have been remarkable differences in the methods of consultation with a doctor. In the years that have passed by, consultation for a disease with a doctor was quite hectic. It involved waiting, traveling, etc. But with the advent of telemedicine opportunities, this has completely changed."
66,How we forecast future technologies?,TECHNOLOGY is playing a dominant role in human life. And as in our daily lifestyle technology is used each and every place where human beings are present. so How we forecast future technologies? 
68,Embedding care robots into society and practice: Socio-technical considerations,"Care Robots, as the name suggests, are robots that are used for hospitality purposes like fetching water, cracking jokes and keeping a patient in good harmony, etc."
70,Are we any closer to preventing a nuclear holocaust?,One thought always comes to my mind…
67,Can robots tackle late-life loneliness?,"In this era, everyone is busy in his life. No one spares time for someone. so robots tackle life loneliness? We have no time to stand and stare. This causes loneliness. Loneliness is due to fast-moving life and hurry and worry. In the 21st century, everyone is spending most of their time earning money. They are day-by-day transforming into money-earning machines. Due to his perception, we are losing our relations as we can’t give enough time to our families. They are busy earning their livelihood. They never get satisfies and always want more. Everyone is in a race of earning and then sends his children far away from himself to make them well settled in order to maintain their status. But one faces the consequences of this kind of lifestyle in his old age. People usually don’t spend time with their children when their children are in their childhood but they yearn for the company of their children in their old age. They feel lonely but have none to talk with. They are still attached to people, places, belongings, and memorable events from the past, although they understand that life cannot continue the same way as earlier, and this may easily result in feelings of loneliness and social isolation. As they become older, they need to be attended to in order to meet their daily needs. Robots can indeed serve the purpose but they can aid only mechanical care. They are just emotionless, feeling fewer entities. Robots aren’t creative. They can work only according to a pre-programmed system and till now no such software has been created that can transfer human feelings into robots. This is the major loophole of using robots to tackle late-life loneliness. They can undoubtedly serve their masters but their masters can’t share their feelings with them as they are incapable to understand or react to them. They can’t change their activity according to the occasion. They can provide anything except emotional satisfaction and without emotional gratification, loneliness can’t be tackled. A master can be attached to his robot but that attachment is only due to their service. They can’t share their thoughts with them. In this era, we are rendered lonely and in late- life feel the need for a companion with whom we can talk. We feel a need for someone who can listen to us, react, and advise us to tackle our day-to-day life problems. But we can’t find one. We have, undoubtedly, achieved great progress in terms of technology but we can never fill the void in the heart of a person struggling with his late-life loneliness with our advancements. We are in a kind of mental trance in which we experience fame, progress, wealth, etc. but when we gain our consciousness, we find ourselves lonely in this world. Relations in life are actual wealth in a person’s life. We can never enjoy such a bond with a robot. It will follow our commands, take our appropriate care but can’t react to our emotions. It can’t console us. When a man lives in loneliness for a long time, it eats up his conscience and transforms him into a machine. Robots can never become our friends, crack jokes, weep our tears, or establish an emotional connection with us. They can’t understand our feelings. Many people go into depression. Depression or the occurrence of depressive symptoms is a prominent condition amongst older people, with a significant impact on their well-being and quality of life. They remain sick and loneliness directly impacts longevity. Lonely people often think that they are no longer needed in this world and thus they want to die. It impacts their mental, psychological, social, and physical health. Robots prove to be useless in these matters. They can provide motivation, only if they have the software to do so but can’t, themselves, react to such a situation. They don’t know about anger, happiness, or sadness. They don’t themselves bring food when their master is hungry until commanded to do so. They can’t even offer a glass of water themselves. A man living without relations and without fellow feeling no longer remains a human being. He becomes none less than a machine as, due to his loneliness, he becomes mentally ill and goes into a condition like trauma where he no longer enjoys nature’s blessings, becomes happy or sad as he loses the ability to react and hence can’t act. It’s a dangerous situation. We face a plethora of challenges in assisted living facilities such as not being addressed to emotional needs, being neglected, and forcing a withdrawal from social activities. Relations in life, interaction with fellow beings, sharing of joy and happiness, and fellow feeling make a man from mere a ‘being’ to a ‘"
71,Will technology eliminate the need for animal testing in drug development?,"Imagine yourself as a being who can speak but no one can comprehend you. You are kept in captivity, in a place where you can hardly breathe. You are finally selected and taken out of that place, it is a happy moment for you. You can finally have your freedom but sadly instead of being free, you are prodded by rods and fed toxic substances against your will. The only thing you can do is scream in vain. Your voice is heard by everyone but it gets lost in the noise of scientific advancement. You writhe in pain as the substances take effect on your body, the pain slowly creeps into your body and you slowly succumb to it, never to wake up again.  "
69,Management challenges for future digitalization of healthcare services,"Management acts as a guide to a group of people working in the organization and coordinating their efforts, towards the attainment of the common objective.Management challenges for future digitalization of healthcare services"
74,What is the chance Homo sapiens will survive for the next 500 years?,"We’ve really done it this year. Like an insatiable glutton, the law of averages has come home to roost. We should’ve taken the hint when on the 1"
73,Will we ever colonize outer space?,"Nature has blessed humanity with earth, a rounded globe where all essential necessity lies in the hand of a human. Though in this 21st-century building Space shuttle and exploring space has become an obvious activity among the human raise, now with the inclusion of Start-ups like Space X once dreamed for reaching out at space now is coming true. We all have to agree upon a fact that in the Growth of industrialization we have generated a humungous carbon footprint and colonize at outer space will create a much-needed area for our survival."
72,Will we ever understand the nature of consciousness?,"The definition of consciousness has been controversial for centuries, hence it is given the title of the ‘most familiar and yet mysterious aspects of our lives’. An idea of this concept would be an awareness in beings of their surroundings, themselves, and their own perception. The reason this part of our mind remains unascertained is that consciousness isn’t observable, unlike brain matter that is studied scientifically. the physical clarification of awareness is in a general sense incomplete: it doesn’t include what it feels to be the subject, for the subject. There likewise is by all accounts an unbridgeable illustrative gap between the physical world and our consciousness. As suggested by an incident of Eastern and Shamir traditions, consciousness is both universal and primal. Whilst we have made tremendous progress in understanding brain activity over the years, this research hasn’t been able to answer all the questions relating to the nature of emotions and experiences."
75,Why does your business need a chatbot?,"Mr. Sakamoto is a bonsai artist, lives downtown Kyoto, Japan. Bonsai is a Japanese art form that is the cultivation of small trees in a small or medium container. He is in this field of business for the last ten years and he loves what he does on a daily basis. People from different cities in Japan, come to buy his artwork. But, in the early stage of his business, he was just another regular Bosai artist. His popularity has increased because of the stories he tells for every art he is selling. His customer immediately loved him for this while buying A Bonsai art. He loved to sell his customer with his artwork and a story related to that product which resurrects his presence through his art in customers. Soon enough his business thrived and nowadays he is always busy. After the digital revolution, although his sales increased, he was not happy. He was not satisfied. Something is eating up his mind day by day. He could not understand what’s the reason behind his remorse."
76,How you lead a project or a team without any technical expertise?,"Have you ever wondered what’s common between Sir Alex Ferguson, Pep Guardiola, and Jose Mourinho? I know it might look a lame question, especially to the ardent football followers. At first instinct, the answer is that they are regarded as the top managers in the football universe. #UCLwinners. But when given a closer look, these managers, weren’t that great when it came to their careers as football players. Any naïve observer can build a fallacy of causation and correlation that those who don’t have a great career as a football player will go on to become a great football manager. But is this restricted just to football? Mike Brearley, one of the greatest captains in the history of cricket and the author of the book the art of captaincy, wasn’t the prolific batsman of his time. Our former President, A P J Abdul Kalam didn’t have a political background, but was still appointed as the president of our country and went to become one of the finest presidents our country has ever had. So, can it be stated with confidence that great leaders need not be the expert in their respective fields?"
78,How does artificial intelligence affect the environment,"When we talk about AI, different people have different perspectives about it. There is one group of people, having good knowledge about the real potential of AI, who believe that AI can be a novel solution to many problems that the world is facing today. There is another group of people who are merely threatened by the thought of AI taking over the world."
81,Global financial crisis 2008 causes/effects and its solution,"The Financial Crisis of 2008 started as a crisis in the subprime mortgage market (i.e. in a market where lending of loans is done to people who may have difficulty in maintaining the repayment schedule or in simple terms, loans were given out to people without proper checks and low credit scores) which ultimately led onto a huge global collapse."
79,How to Overcome Your Fear of Making Mistakes,"No one can reduce mistakes to zero, but you can learn to harness your drive to prevent them and channel it into better decision making. Use these tips to become a more effective worrier."
80,Is Perfection the Greatest enemy of Productivity?,What’s perfection really? Does every person expect perfection from oneself or someone else? Or is it in certain amounts? Many times the certain question comes to the mind when we think about what we deem perfect. But how do we verify it?
77,Can You Be Great Leader Without Technical Expertise,"The word “leadership” can bring to mind a variety of images. For example, A political leader, pursuing a passionate, personal cause or An executive, developing his/her company’s strategy to beat the competition. Leaders help themselves and others to do the right things. They set direction, build an inspiring vision, and create something new. Leadership is about mapping out where you need to go to “win” as a team or an organization; and it is dynamic, exciting, and inspiring."
82,Gender diversity and Equality in the tech industry,"Gender diversity is an equal representation of all genders in workplaces. One of the most important sectors where there is under-representation of gender diversity is the technological industry. Gender diversity means you have an equal opportunity which is not limited by gender. But, the true reality is gender diversity is a far outcry in the world."
83,How to overcome your fear of making mistakes?,"The Covid-19 crisis and its fallout including recession, layoffs, and uneven economic pain-as well as recent protests over police brutality and demands for racial justice, have presented many of us with challenges that we’ve not encountered before. The high-stakes and unfamiliar nature of these situations have left many people feeling fearful of missteps. No one can reduce mistakes to zero, but you can learn to harness your drive to prevent them and channel it into better decision making. Use these tips to become a more effective worrier."
84,How Small Business can survive the Coronavirus Crisis,"The word pandemic may be the most used word for the last decade, and we know why. The year 2020 comes with a lot of unprecedented threats to humans as well as to nature. While no business was left insulated from its effect, small businesses were one of the most affected, as they rely on day to day sales and keep the inventory minimum, based on the demand of customers and have a low margin to maneuver."
