url_id,article_title,article_text
139,INDUSTRIAL REVOLUTION 4.0 – PROS AND CONS,"Before jumping to the pros and cons of industrial revolution 4.0, it is important to understand industrial revolution 4.0. Industrial Revolution 4.0: Industrial revolution 4.0 is the term that is used to describe the transition from an electronic-based industry to the one that is dominated by the fusion of new and emerging fields and ideas like Artificial Intelligence, robotics, and green energy, etc."
137,What do you think is the lesson (or lessons) to be learned with Covid 19?,", the John Hopkins Center for Health Security ran a simulation called “Parainfluenza Clade X” to determine what the potential would be of a virus pandemic, and they concluded: “…"
136,Why is there a severe immunological and inflammatory explosion in those affected by sarms covid-19?,"Why is there a severe immunological and inflammatory explosion in those affected by arms covid-19? are these only genetic causes related to the immune response of il6 and macrophages, or would other types of scenarios be related to some environmental element? "
142,Impact of Indian Economy due to COVID-19,"The Novel Coronavirus (COVID-19),
Initially emerged in China at the end of  2019 and by the end of January
2020, The World Health Organization declared this pandemic as a Public Health
Emergency of International Concern. This virus
causes respiratory illness (like the flu) with symptoms such as a cough, fever,
and in more severe cases, difficulty in breathing or may cause lung disease.
Senior Citizens or people under some medical treatment are more likely to
acclimate to this virus."
131,What are the key policies that will mitigate the impacts of COVID-19 on the world of work?,"From Alibaba to Ping An and Google to Ford, companies around the globe are telling staff to figure from directly from home in a bid to stem the spread of COVID-19. Such remote functioning at scale is unprecedented and can leave a long-lasting impression on the way people live and work for several years to return. China, which felt the primary impact of the pandemic, was an early mover during this space. As home to a number of the world’s largest firms, it offers lessons for people who are just commencing to embrace the shift. Working from home skyrocketed in China within the wake of the COVID-19 crisis as companies "
140,COVID-19 Vs Indian Economy,"India is on the verge of an unprecedented economic as well as humanitarian disaster from COVID-19. India is facing economic pressure due to the coronavirus outbreak. This outbreak has resulted in a steep slowdown in the Indian economy, whereby India’s GDP has reduced by 4.5% as seen by current statistics. With COVID-19 being into the picture the Indian economy is going through a severe slowdown and on top of that multiple such problems hitting the world of work from many such directions. Companies and industries are finding it difficult to sustain in such an environment of the financial crisis. Industries are being urged to take up certain tough decisions like layoff, retrenchment, compulsive leave without pay and many alternative cost-effective methods to sustain the present economic crisis like cutting down the salaries, handing over the pink slip to employees and opting best possible. The sudden outbreak has presented new roadblocks for the Indian workforce and especially for the daily wage and contractual workers."
145,Blockchain in Fintech,"Blockchain or the Distributed Ledger Technology has
already been around for some time now. Cryptocurrencies like Bitcoin, based on
the Blockchain technology, are making entry into the formal finance world and
increasingly becoming a medium for exchange. Though there are many potential
use cases for Cryptocurrencies and the Indian Government is very critical about
implementing the technology in banking and finance, it still has a lot of
issues to be resolved before we can commercially use it for transactions. "
147,The future of Investing,"An investment is a resource or thing procured with the objective of producing pay or appreciation. Economically, investment is to buy products that are not expended nowadays but are utilized within the future to make riches. Financially, an investment can be a money related resource acquired with the idea that the resource will give wage within the future or will afterward be sold at the next cost for a benefit. "
143,Impact of newly discovered coronavirus on the Global Economy,"What is Coronavirus? Is it a disease? How it
is spread to humans? How Coronavirus affects the world economy? Several
questions come in mind when we talk about the Coronavirus."
129,Coronavirus: Impact on the Hospitality Industry,"Before jumping on the topic I would like to give an overview of what is Coronavirus, Covid-19, how it spreads, and its symptoms."
146,Blockchain for Payments,"between having a tight budget and being seriously stretched thin for money. Dangerously enough during the second month of my MBA, I was treading on the prospect of the latter. It struck me that I could find my savior in an uncle who lived in San Jose and was the type who always saved for a rainy day. With online payment avowedly ubiquitous and simple, it seemed like a no-brainer to me. One tap on an app and I would be rid of this predicament I had found myself in. Quickly enough, he initiated a fund transfer via Xoom, a PayPal service. I was dismayed to learn it would take all of three days for the money to finally reach me!"
149,Business Analytics In The Healthcare Industry,"Analytics is a statistical scientific process of discovering and presenting the meaningful patterns that can be found in data. While business analytics refers to the skills, technologies, applications, practices, computer programming and operations research for the continuous exploration of data to gain insight that drives business decisions."
141,Impact of COVID-19 (Coronavirus) on the Indian Economy,"The
corona outbreak has hit us hard. With the world economy suddenly coming to a
standstill, the future seems more uncertain. The pandemic has shown its worst
effect in the developed countries most. "
148,Big Data Analytics in Healthcare,"Quality and affordable healthcare is a vision of all governments across the globe. The high cost of Medical service and lack of sufficient infrastructure is detrimental to this vision. In developed countries such as the U.S., reducing healthcare cost is an agenda point of all the politicians.  Even in India, affordable healthcare will be as important as "
150,Challenges and Opportunities of Big Data in Healthcare,"To begin with I shall first like to explain what big data is and why it has become so important in our lives. Big data is simply data, but with a huge size. Data that is not just voluminous but also growing exponentially with time. Such data sets are so large and complex that it is not possible to store or process them using traditional data management tools. So, how huge can this data be? Social media sites like Facebook generate more than 500 terabytes of new data every day in the form of photos, video uploads, text messages, etc. A single Jet engine can generate more than 10 terabytes of data in 30 minutes of flight time. With many thousand flights per day, generation of data reaches up to many petabytes. Data contained in these sets are not always structured. It can be semi-structured or even unstructured. When such is the size and dimension of data we can well imagine how complicated it must be to process and analyze it. Therefore, modern methods of data analysis are being developed and used to process the information contained in big data sets."
