url_id,article_title,article_text
85,Impacts of COVID 19 on Food products,"Some vendors (fruit and vegetable sellers) began venturing out after a few days without explicit permission and immediately faced police harassment. After a few weeks, the government eased restrictions and essential vendors were being permitted to vend (due in large part to the advocacy of vendor organizations and activist networks). However, the cost of doing business, as well as the risk, has gone up significantly, with vendors not having access to wholesale markets and suppliers and having to spend more on travel costs due to travel restrictions in place in the city. Also, with the lockdown still partially in place, the number of buyers has gone down and so have earnings. Due to the harsh summer heat, perishable fruits and vegetables also have a reduced shelf life so vendors are unable to capitalize on whatever produce they do have."
87,Impact of COVID-19 pandemic on Tourism & Aviation industries,"As the Coronavirus pandemic unfolds, most industries face problems they had never imagined or prepared for. The Aviation and Tourism industries face the highest stress as Coronavirus spreads because not only are they a (usually) a leisure spending but also the nature of the disease directly conflicts with the industries’ innate business models. In this article, we will look at the impact of COVID-19 pandemic on the Tourism and Aviation industries both from the demand side and the supply side."
86,Impacts of COVID 19 on Vegetable Vendors,The 
88,Impact of COVID-19 pandemic on sports events around the world.,"The COVID-19 pandemic has caused the most significant disruption to the worldwide sporting calender since World war II. Across the world and to varying degrees, sports events have been canceled or postponed. The 2020 Summer Olympics in Tokyo were rescheduled to 2021. Spectators have no games to watch and players no games to play. Only a few countries, such as Turkmenistan Belarus and Nicaragua, have continued professional sporting matches as planned."
90,"Online gaming: Adolescent online gaming effects demotivated, depression, musculoskeletal, and psychosomatic symptoms.","A video game is any software program that can be played on a computing device, such as a personal computer, gaming console, or mobile device. Video games have been in existence since the early 1970s and have become increasingly popular, spanning different mobile (smartphones, tablets) and stationary (computer or console) platforms. Advances, particularly in mobile devices, have given birth to social networks and group gaming"
89,Changing landscape and emerging trends in the Indian IT/ITeS Industry.,"The COVID 19 pandemic has reshaped the fundamental fabric of our world. Initiating in China in late December 2019, the virus has since then spread to every corner of the world, infecting millions in its wake. Countries around the world have responded by shutting down their economies and advocating lockdowns of varying degrees. India has arguably had one of the most stringent lockdowns of all countries, restricting the movement of people, goods and effectively transforming every city into a ghost town."
91,,"Read on to discover what our robot, Athena, has found on the future of this topic and act accordingly for you, your family, and organization in the years ahead. Make notes on issues that could affect you and them as you go."
92,,"Finding ways to make using the Internet easier is something most modern consumers are passionate about. Since the rise of AI-infused technology like Amazon’s Alexa or Apple’s Siri, voice search has grown increasingly popular. In fact, nearly 60 percent of people all over the world use voice search at least once a day."
94,How to increase social media engagement for marketers?,"Social media is such a staple of our evolving digital culture that it’s almost hard to imagine a time without updates, likes, comments, and shares. People are more concerned about how their food looks than about how it tastes. Thus, it has become necessary for any brand to have a social media presence. The phrase “Out of sight, out of mind” has never been so apt than in today’s time. Social media is as much about engagement with other people as it is about sharing content. It’s why we call it “social” media."
96,Coronavirus impact on energy markets,"The coronavirus, also known as COVID-19, is not only a global public health emergency but also a source of significant regional and increasingly global economic disruption. This impacts the energy and climate world in many ways. The economic downturn puts pressure on global oil prices leading the Organization of Petroleum Exporting Countries (OPEC) to consider further cuts to production. It hurts the demand for natural gas during a time of extremely low prices. It changes the economic, energy, and climate policymaking environment in China, one of the most consequential energy consumers and sources of greenhouse gas emissions. And it has temporarily disrupted supply chains throughout the energy industry, including renewable energy, at a time when supply chain connections with China were being revaluated due to ongoing tariff and trade disputes. How consequential or transformative any of these changes are for the energy sector or for climate efforts will depend upon the ultimate trajectory of the virus outbreak itself"
93,How the COVID-19 crisis is redefining jobs and services?,"The pandemic has shaken the world in the way one had hardly imagined. The impact of it on Jobs and Services is going to be long-lasting and it will be the foundation stone of revolution in these sectors. With the work from home and social distancing norms is altering the way of work, the way we interact, what work we will do, how the work will be done, and whatnot. To just give an example, in the middle of the first lockdown, FMCG major Hindustan Unilever (HUL) went ahead with its merger. It took place online entirely. Yes, it took place online. Who could have ever imagined the merger can take place online?"
95,Impacts of COVID 19 on Streets Sides Food Stalls,"Petty Entrepreneurs like Streetside Food Stalls form an essential part of an economy that plays a significant role in balancing the development of a nation’s economy. The importance of street food vendors not only helps in increasing the country’s per capita income but also helps to make a living for the unemployed in society with a limited investment. Most of them are the sole breadwinners for their families. So, with the Covid-19 wreaking havoc, the uncertainty of the lockdown policies increased the concern of people over hygiene and the lack of investment to upgrade their businesses to provide better hygiene facilities that can take away food from their mouths."
97,COVID-19 Impact on Hospitality Industry,"In December 2019, a novel coronavirus strain (SARS-CoV-2) emerged in the city of Wuhan, China. The disease called Covid-19 spread to almost every nation in the world creating widespread havoc and disruption in routine life. WHO recognized it as a pandemic on March 10, 2020. As of April 19, 2020, worldwide around 24 lakh people have been infected and more than 1.6 lakh people have succumbed to Covid-19."
99,Estimating the impact of COVID-19 on the world of work,"COVID-19 an unprecedented pandemic for us but a “Can-be” possibility for great leaders such as bill gates came into action since the rising of the year 2020. The corollary of this pandemic is so prodigious that the analysis by the UN Department of Economic and Social Affairs (DESA) stated that the COVID-19 pandemic is disrupting global supply chains and international trade which in turn could shrink the global economy by up to 1 percent in 2020, a reversal from the previous forecast of 2.5 percent growth. More than 6.6 million Americans filed unemployment claims and the economic downturn is expected to be the worst recession since the Great Depression as stated by the IMF. India is facing its biggest crisis in decades, with a three-week lockdown initially, but extending further in a nation of 1.3 billion people likely to result in an economic recession, millions of job losses and possible starvation among the poor. It can be said that economic contagion is now spreading as fast as the disease itself. On the contrary nature has pressed the reset button, the environment is having a noticeable benefit from this scenario. Water is getting clearer, the air is turning breathable and various such news and pictures can be easily heard and seen on newspapers, telly, and social media platforms on day to day basis. But this is the storyline of the present, what about the future? Are the predictions made by financial institutions and thought leaders going to be true? Or something unexpected is going to happen that will make us think of our human capabilities again?"
100,,"Globalization envisages a borderless world or seeks the world as a global village • It is attributed to the accelerated flow of goods, people, capital, information, and energy across borders, often enabled by technological developments."
101,Travel and Tourism Outlook,"The UN projects a 20-30% decline in international tourist arrivals in 2020. This could put up to 50 million jobs at risk, with Asia likely to be the most affected continent. But will the good old days of tourism and travel return next year?"
104,Due to the COVID-19 the repercussion of the environment,"Epidemics, in general, have both direct and indirect costs associated with direct and indirect measures adopted to counter (control) the epidemic which generally have both short-run and long-run economic and social consequences. The 2019 Coronavirus (COVID-19) outbreak globally lead a significant setback to the entire globe. The first case was detected on 26"
102,Gaming Disorder and Effects of Gaming on Health.,Perhaps the virtual illusion has become today’s “New Reality”.
103,What is the repercussion of the environment due to the COVID-19 pandemic situation?,"On 31st December 2019, a novel coronavirus was identified in Wuhan, China. It spread like wildfire in the world. On 11th March 2020, WHO declared COVID 19 as a pandemic and issued guidelines like Sanitizing hands regularly, wearing masks, and social distancing as viable methods for prevention against this virus."
98,Lessons from the past: Some key learnings relevant to the coronavirus crisis,"As a race, we are not ready for any kind of crisis. We have fire extinguishers in buildings, but barely any knowledge of how to use it. We convince ourselves that we are prepared but in the face of adversity we stand dumbfounded and give the simplest excuse, that of being in ‘unprecedented times’. The same thing has happened with the coronavirus crisis. If we look back, we can see that this crisis was not avoidable. There was a lot we could have done, but because we underestimated it so much, the situation has now blown out of proportion and cost us thousands of lives, millions of jobs and a massive hit to the world economy. We may be in a unique condition but there is still a lot that we can apply from past experiences and previous calamities. "
105,Impact of COVID-19 pandemic on office space and co-working industries.,"COVID 19 has bought the world to its knees. With businesses being shut, travel being banned, schools, and colleges being closed, we have observed an impeccable amount of sorrow and despise along with a great amount of mental torture and destruction. Though situations are improving now, and the lockdowns are being lifted, it is a fact that it cannot be shunned that this virus will have a long term impact on people, and the effects will not only be felt economically and physically but also mentally."
106,Contribution of handicrafts (Visual Arts & Literature) in the Indian economy,"Handicrafts is an art of making crafts by hand in India is called Indian handicrafts, in ancient India people lived in colonies called tribals and they were used to make utility items for their daily needs, that art of making the crafts called handicrafts, and the items called handicrafts goods."
107,,I would rather pay cash – Before COVID-19.
108,,"As business close to help prevent transmission of COVID-19, financial concerns and job losses are one of the first human impacts of the virus;"
111,How Coronavirus Impact on the Hospitality Industry,"While Coronavirus has affected the life of every individual, it has also affected various industries for better or for worse. While certain industries like Pharma, Mobile and Web-streaming industries, Fitness and Teleconference apps have boomed during this pandemic, industries like Tourism, Fast-Food Industry, Retail and Leisure sectors have suffered the worst hit due to Coronavirus Impact"
109,Lessons from the past: Some key learnings relevant to the coronavirus crisis,"So, not beginning with once upon a time because it is not a fairytale. Before the advent of this deadly virus called Coronavirus or with all love that we might want to call it COVID-19, the life wasn’t smooth as people are cribbing about."
110,COVID-19: How have countries been responding?,The COVID-19 pandemic is impacting communities all over the world.
113,Coronavirus: Effect on the Hospitality Industry,"The hospitality sector in India has witnessed unprecedented deceleration this year in the wake of the COVID-19 pandemic. The Indian hotel sector has been hit hard, tussling with significantly low demand, with very few future bookings. Since the outbreak of COVID-19, companies have been canceling interviews at the top hotel management colleges in India. The "
114,Estimating the impact of COVID-19 on the world of work,These are just a few terms that come to mind when you wake up every morning and listen to the world mourning. With the 
112,,"A respiratory illness that started from patient zero in Wuhan, a city in China, has now engulfed the entire globe in its clutches. With over 2 million confirmed cases and deaths north of 100,000, Coronavirus, better known as COVID-19, is a challenge unfathomed. History is earmarked with infections and diseases that ravaged continents time and again—Black Death decimated Europe by claiming 200 million lives between 1347 and 1352, Smallpox killed 500 million over decades, bouts of Cholera outbreaks, the emergence of HIV/AIDS and what not—the list is huge and intimidating. But COVID-19 is cut from a different cloth, exposing various loopholes and the modern world’s inability to fend off pandemics and epidemics despite advancements in Science, healthcare, and technology."
117,Lessons from the past: Some key learnings relevant to the coronavirus crisis,"As we speak, the world finds itself engulfed in one of its worst crises in recent times. The global COVID-19 pandemic has caused never-seen-before disruption in both public and economic life. Not only have factories shut down or supply chains abruptly stopped or millions of workers stranded, but festivals suspended, families separated across countries and public-healthcare systems put under tremendous stress. Such a scenario is a first-time for many, but the world has been through pandemics of a similar scale and nature before, and after the due struggle, emerged victoriously. As the more experienced amongst us would remember, the SARS and MERS outbreaks in the early 2000s presented a similar scenario, although at a much lower rate of infection, yet with higher rates of morbidity. Going back further in time, the 1918 Spanish Flu brought a world just out of the first world war, to a standstill. Considered to be the worst amongst modern-era pandemics, the Influenza pandemic affected one-third of the world’s population and 50 million lives. Yet, preventive measures such as social-distancing, quarantine, mass-vaccinations, public support, and restraint have proved to be successful in all such situations, even being effective in occasional plague outbreaks across the world. We face a similar situation today – an extremely infectious virus, which has already spread globally, confined people to their homes and is causing tremendous economic loss every minute economic activity remains suspended, affecting both the government and the industries alike. "
119,Coronavirus: Impact on the Hospitality Industry,"Coronavirus, now globally carrying the status of a pandemic, has led to a worldwide crisis with its effects on the hospitality industry potentially heavier than those of 9/11, SARS, and the financial crisis in 2008. know how Coronavirus Impact the Hospitality Industry"
120,Why scams like Nirav Modi Happen with Indian banks?,"India has been beset by financial scams since Independence. Every 4-5 years, Indian citizens hear about so many trillions of public money being misappropriated and eventually lost by people who the public is supposed to start. In this article, with examples, I would like to point out that there are two factors to scams like Nirav Modi: the complicity of actors within the financial industry and the systemic loopholes in an emerging financial system that has been used for scams like Nirav Modi."
121,IMPACT OF COVID-19 ON THE GLOBAL ECONOMY,"It was 14th March and I was
altogether prepared for my last theater competition of this very year. "
124,Impact of COVID-19 (Coronavirus) on the Indian Economy,"From the economic point of
view, India is confronted today with perhaps its greatest emergency since independence. The global financial
crisis in 2008-09 was a gigantic demand shock, but our workers could still get-up-and-go to work, our firms were coming off years of steady growth, our financial system was largely sound, and our government finances were blooming. None of this is true today as
we fight the
coronavirus pandemic. Yet
there is also no reason to
despair. With the right undertakings and
priorities, and drawing on India’s many sources of strength, it can kill this virus back, and even set the stage for a much more hopeful tomorrow."
123,Global Economy effected by Coronavirus,Coronavirus disease  (COVID-19)  is an infectious disease caused by a  newly discovered coronavirus.
122,Impact of coronavirus on the Indian economy,Nathan Wolfe
125,Should celebrities be allowed to join politics?,"In today’s day and age of hyper-connectivity, celebrities – dubbed by Fraser and Brown (2002) as people who are famous for being famous and may or may not always serve others sacrificially – live in glass houses that are open to the prying eyes of the public. Notification bars are ever abuzz with news about when these celebrities wake up, what they wear to the gym, what they eat, and where they go on their vacations. In the idealized and idolized eyes with which society views celebrities, this unceasing visibility gives them an all-pervasive influence. The dominance of celebrities in swaying opinions of their acolyte is well-established – from"
126,How prepared is India to tackle a possible COVID-19 outbreak?,"Frankly, no! The state of the public healthcare system, still vast, is very fragmented and cannot scale up rapidly enough to face the challenge of a pandemic such as COVID-19. The origin of public healthcare lies in the British colonial period where such facilities were provided only to British officers and their families stationed in India. From the 1960s onwards, the independent government of India stressed more upon healthcare and it led to the creation of the modern public healthcare system in India. The healthcare system is organized into primary, secondary, and tertiary levels. At the primary level are Sub Centre’s and Primary Health Centre’s (PHCs). At the secondary level there are Community Health Centre’s (CHCs) and smaller Sub-District hospitals. Finally, the top level of public care provided by the government is the tertiary level, which consists of Medical Colleges and District/General Hospitals. The number of PHCs, CHCs, Sub Centre’s, and District Hospitals has increased in the past six years, although not all of them are up to the standards set by Indian Public Health Standards. But there are still critical challenges to the existing system."
128,Controversy as a Marketing Strategy,"Organizations burn a lot of resources to build one iconic image. Their brand is not just a picture, a logo, and colors; but an emotional connection with the consumer. It develops by making an impression on the consumers each time they interact with the products or services and it becomes ingrained in the consumers’ minds. Now, if it takes great efforts to build such impression, recognition, and trust, why would a firm do something controversial that could burn their own hands?"
127,How will COVID-19 affect the world of work?,"Every prophet of doom, unless he also happens to be a psychopath, hopes that his predictions will not be borne out. This is also true for the epidemiologists and virologists who have been warning the world since January that the novel SARS-CoV-2 virus poses a severe threat to public health around the world. The name Coronavirus itself, is vicious enough to terrify those who otherwise are fearless in the face of any ball game. Tracing back the origins of the now pandemic, we find that the coronavirus emerged in Wuhan, a city of 11 million people in China’s Hubei province, in late 2019. Cases of the disease grew by several thousand per day in China in late January and early February, the peak of the epidemic there. The number of infections appearing each day has since plummeted in China, making the outbreak a global pandemic that has engulfed over 214 countries around the globe."
116,How will COVID-19 affect the world of work?,"COVID19 affects the world from every way life emotional to social, philosophy to physical. Economical to the thread of life…it is known as present as part of life. which tell as on a daily base to the world just stop your self where you are present..if you move you will lose to yourself and to others, it’s like a story which tells which we listen in our childhood one dirty fish harm the all see."
133,Continued Demand for Sustainability,The 
115,COVID-19: How have countries been responding?,"“If anything kills over 10 million people over the next few decades, it’s most likely to be a highly infectious virus rather than a war” – Bill Gates"
130,Coronavirus impact on energy markets,"As the coronavirus spreads around the world and countries implement containment measures, energy supply and demand is being disrupted. The impact that country-wide lockdowns and demand slowdowns will have on energy markets will be evolving every day."
132,Marketing Drives Results With A Focus On Problems,"When
the British ruled India, many Indians
accepted to work under their policy, and they did not try to rebel against the British for
their presence in Indian lands; They recognized the benefits of British rule. What
was the factor that made Indians accept the
British government? The perception about
British-policies (about trading, pay-scale, and positioning in the military) had been
done through various marketing channels in such a way that it brainwashed people of the nation, and many were ready to accept the British. So the Marketing is like fire when smartly
handled; it can destroy your enemies, but when not it can burn you.  "
135,Should people wear fabric gloves? Seeking evidence regarding the differential transfer of COVID-19 (or coronaviruses generally) between surfaces?,"Is there any evidence about whether fabric or bare hands would spread covid-19 more from one surface to another? (e.g. opening a door using a fabric glove). Assuming the fabric doesn’t touch your face, like bare hands easily do, even with efforts to remember not to people struggle to remember. I’ve been thinking of prompts to prevent face touching, such as wearing fabric gloves when out and about, but I don’t want to promote this unless the fabric is at-least-no-worse than hands for transferring the virus between surfaces."
118,Lessons from the past: Some key learnings relevant to the coronavirus crisis,"The current topic that is burning the world alive is the deadly coronavirus. Let us first understand what this coronavirus actually is. According to the World Health Organization (WHO), the Coronavirus disease which is called the COVID-19 is an infectious disease which is caused by the newly discovered Coronavirus. The COVID-19 virus is a virus that affects different people of the world in different ways. The COVID-19 disease is a respiratory disease and most of the infected people will develop mild to moderate symptoms and recover without even requiring special treatment.  The people who already have underlying medical conditions and those people who are over 60 years old have a higher risk of developing severe disease and death."
134,Coronavirus Disease (COVID-19) Effect: The Impact and Role of Mass Media During the Pandemic,"The outbreak of coronavirus disease 2019 (COVID-19) has created a global health crisis that has had a deep impact on the way we perceive our world and our everyday lives. Not only the rate of contagion and patterns of transmission threatens our sense of agency, but the safety measures put in place to contain the spread of the virus also require social distancing by refraining from doing what is inherently human, which is to find solace in the company of others. Within this context of physical threat, social and physical distancing, as well as public alarm, what has been (and can be) the role of the different mass media channels in our lives on individual, social and societal levels?"
138,"Coronavirus, the unexpected challenge for the European union","Since the creation of the EU, we have been through many challenges worst than public health issues."
